{
  "schema_version": "1.0.0",
  "package_revision_id": "11111111-1111-4111-8111-111111111111",
  "analysis_eligible": true,
  "export_eligible": true,
  "readiness": {
    "numerator": 1,
    "denominator": 1,
    "score": 1
  },
  "deterministic_checks": [
    {
      "check_id": "package.digest_verified",
      "severity": "analysis_blocker",
      "outcome": "passed",
      "message": "The package content digest matches the immutable manifest.",
      "evidence_references": [
        {
          "reference_id": "content-manifest.json",
          "sha256": "aaaaaaaaaaaaaaaaaaaaaaaaaaaaaaaaaaaaaaaaaaaaaaaaaaaaaaaaaaaaaaaa"
        }
      ]
    }
  ],
  "analysis_blockers": [],
  "export_blockers": [],
  "warnings": [],
  "authority_fingerprint": {
    "authority_manifest_id": "authority.v2",
    "sha256": "bbbbbbbbbbbbbbbbbbbbbbbbbbbbbbbbbbbbbbbbbbbbbbbbbbbbbbbbbbbbbbbb"
  },
  "profile_fingerprint": {
    "profile_id": "fisma_agency_security",
    "profile_version": "2.0.0",
    "sha256": "cccccccccccccccccccccccccccccccccccccccccccccccccccccccccccccccc"
  },
  "evaluated_at": "2026-07-10T20:00:00Z"
}
